<?xml version="1.0" encoding="UTF-8"?>
<xs:schema xmlns:xs="http://www.w3.org/2001/XMLSchema" elementFormDefault="qualified">

  <xs:element name="Hotels">
    <xs:complexType>
      <xs:sequence>
        <xs:element name="Hotel" maxOccurs="unbounded">
          <xs:complexType>
            <xs:sequence>
              <xs:element name="Name" type="xs:string"/>
              <xs:element name="Phone" type="phoneType" maxOccurs="unbounded"/>
              <xs:element name="Address" type="addressType"/>
            </xs:sequence>
            <!-- Optional attribute on Hotel -->
            <xs:attribute name="Rating" type="xs:decimal" use="optional"/>
          </xs:complexType>
        </xs:element>
      </xs:sequence>
    </xs:complexType>
  </xs:element>

  <xs:complexType name="addressType">
    <xs:sequence>
      <xs:element name="Number" type="xs:string"/>
      <xs:element name="Street" type="xs:string"/>
      <xs:element name="City" type="xs:string"/>
      <xs:element name="State" type="xs:string"/>
      <xs:element name="Zip" type="xs:string"/>
      <xs:element name="NearestAirport" type="xs:string"/>
    </xs:sequence>
  </xs:complexType>

  <xs:complexType name="phoneType">
    <xs:simpleContent>
      <xs:extension base="xs:string">
        <!-- Required attribute so we can trigger Q1.3(2) by removing it in the error file -->
        <xs:attribute name="primary" type="xs:boolean" use="required"/>
      </xs:extension>
    </xs:simpleContent>
  </xs:complexType>

</xs:schema>
